[
  {
    "id": "claim_patriarchal_horizon_saga",
    "epoch_id": "patriarchal_horizon",
    "statement_ru": "Рассказы о праотцах в Бытии — литературное предание родословной Израиля, а не датируемая внешними анналами биография.",
    "confidence": "literary",
    "date_min": null,
    "date_max": null,
    "source_ids": [
      "genesis_narrative",
      "modern_handbook"
    ],
    "citations": [
      {
        "id": "cite_claim_pat_saga_gen12",
        "label_ru": "Быт 12",
        "kind": "verse",
        "source_id": "genesis_narrative",
        "ref": "Gen.12",
        "url": "https://www.biblegateway.com/passage/?search=Genesis+12&version=NRSVUE"
      },
      {
        "id": "cite_claim_pat_saga_hb",
        "label_ru": "Patriarchs (обзор)",
        "kind": "handbook",
        "source_id": "modern_handbook",
        "url": "https://en.wikipedia.org/wiki/Patriarchs_(Bible)"
      }
    ]
  },
  {
    "id": "claim_patriarchal_horizon_setting",
    "epoch_id": "patriarchal_horizon",
    "statement_ru": "В учебном консенсусе «мир праотцев» часто описывают как культурный фон II тыс. до н.э., без жёсткой абсолютной хронологии событий.",
    "confidence": "literary",
    "date_min": null,
    "date_max": null,
    "source_ids": [
      "modern_handbook"
    ],
    "dissent_ru": "Консервативные реконструкции пытаются привязать Авраама к MB II; критический мейнстрим этого не делает.",
    "citations": [
      {
        "id": "cite_claim_pat_setting_hb",
        "label_ru": "Abraham (хронология дискуссии)",
        "kind": "handbook",
        "source_id": "modern_handbook",
        "url": "https://en.wikipedia.org/wiki/Abraham#Historicity"
      }
    ]
  },
  {
    "id": "claim_patriarchal_horizon_joseph_cycle",
    "epoch_id": "patriarchal_horizon",
    "statement_ru": "Цикл об Иосифе в Египте — новеллистическое предание; египетский колорит не даёт надёжной абсолютной датировки.",
    "confidence": "literary",
    "date_min": null,
    "date_max": null,
    "source_ids": [
      "genesis_narrative",
      "modern_handbook"
    ],
    "citations": [
      {
        "id": "cite_claim_pat_joseph_gen37",
        "label_ru": "Быт 37",
        "kind": "verse",
        "source_id": "genesis_narrative",
        "ref": "Gen.37",
        "url": "https://www.biblegateway.com/passage/?search=Genesis+37&version=NRSVUE"
      },
      {
        "id": "cite_claim_pat_joseph_wiki",
        "label_ru": "Joseph (Genesis)",
        "kind": "web",
        "source_id": "genesis_narrative",
        "url": "https://en.wikipedia.org/wiki/Joseph_(Genesis)"
      }
    ]
  },
  {
    "id": "claim_patriarchal_horizon_genealogy",
    "epoch_id": "patriarchal_horizon",
    "statement_ru": "Цепочка Авраам–Исаак–Иаков в Бытии задаёт генеалогическую рамку предания; внешняя биографическая аттестация отсутствует.",
    "confidence": "literary",
    "date_min": null,
    "date_max": null,
    "source_ids": [
      "genesis_narrative",
      "modern_handbook"
    ],
    "citations": [
      {
        "id": "cite_claim_pat_geneal",
        "label_ru": "Быт 21–28",
        "kind": "verse",
        "source_id": "genesis_narrative",
        "ref": "Gen.21-28",
        "url": "https://www.biblegateway.com/passage/?search=Genesis+21-28&version=NRSVUE"
      }
    ]
  }
]
